{
  "$schema": "https://recursive-dev-loop.dev/schemas/knowledge-capsule.v1.schema.json",
  "schema_version": "1.0.0",
  "capsule_id": "capsule-dsh-adapter-boundary",
  "capsule_version": "1.8.0",
  "title": "dsh and optimizer adapter boundary",
  "audience": "Agents and maintainers planning dsh, Cordis, GEPA, SkillOpt, or evaluation integration",
  "checked_at": "2026-09-16",
  "refresh_after": "2026-12-01",
  "sources": [
    {
      "id": "src-dal-architecture",
      "kind": "local_file",
      "uri": "repo://docs/architecture.md",
      "revision": "dal-paid-e2e-preflight-2026-09-08",
      "sha256": "55791488b1a41517cd35b13d93c2080c523d469e39d37c0f469587faf14ece19",
      "local_path": "../docs/architecture.md",
      "required": true
    },
    {
      "id": "src-dal-research",
      "kind": "local_file",
      "uri": "repo://docs/research-evidence.md",
      "revision": "dal-v0-2026-08-29",
      "sha256": "6dec1620e823fda16ffc9a5f14e72af855301eb5adf581dfac7f9cab2e5e2251",
      "local_path": "../docs/research-evidence.md",
      "required": true
    },
    {
      "id": "src-dal-roadmap",
      "kind": "local_file",
      "uri": "repo://ROADMAP.md",
      "revision": "chg-dal-live-text-loop-20260916-reviewed",
      "sha256": "d3cde5f8a59dbd7e273bf1a16b4ac43302d6f2055d6864a260e52dc86801f753",
      "local_path": "../ROADMAP.md",
      "required": true
    },
    {
      "id": "src-runtime-generation-contract",
      "kind": "local_file",
      "uri": "repo://docs/runtime-generation-attestation.md",
      "revision": "runtime-generation-attestation-2026-09-02",
      "sha256": "5b3f9137ba109c49c2eb6c163ae01aa8959dae82df717e93f2a46295127ea196",
      "local_path": "../docs/runtime-generation-attestation.md",
      "required": true
    }
  ],
  "claims": [
    {
      "id": "claim-project-integration",
      "text": "Default dsh integration uses repository instructions and project-local skill discovery; optional plugin source and user-global deployment do not alter a shared profile or home configuration without their separate exact approvals.",
      "source_ids": [
        "src-dal-architecture",
        "src-dal-research"
      ]
    },
    {
      "id": "claim-optional-cordis",
      "text": "Legacy workbench profile installation or mounting remains opt-in and separately approved. The live text host is a separately packaged, tool-free native-service composition with its own mount approval and awaited disposal. It does not establish the general recorder's final-disposal durability or HMR readiness.",
      "source_ids": [
        "src-dal-architecture",
        "src-dal-roadmap",
        "src-runtime-generation-contract"
      ]
    },
    {
      "id": "claim-provider-neutral",
      "text": "The SkillOpt-shaped prepare/evaluate adapter is deterministic and provider-neutral; GEPA and SkillOpt optimizer runtimes do not run in v0, and HMR plugin candidate application is unavailable pending authoritative imported-closure identity and awaited readiness.",
      "source_ids": [
        "src-dal-architecture",
        "src-dal-research",
        "src-dal-roadmap"
      ]
    },
    {
      "id": "claim-evaluation-options",
      "text": "Promptfoo is the primary future CI experiment candidate; PyRIT and Langfuse or Phoenix remain optional red-team or observability adapters, not installed v0 dependencies or authority sources.",
      "source_ids": [
        "src-dal-research",
        "src-dal-roadmap"
      ]
    },
    {
      "id": "claim-dsh-tool-hooks",
      "text": "The inspected DSH version has pre-execute, execute, and post-execute tool waterfalls; its final tools/result notification is observation-only, not a fourth enforcement waterfall.",
      "source_ids": [
        "src-dal-architecture",
        "src-dal-research"
      ]
    },
    {
      "id": "claim-dsh-trajectory",
      "text": "A future DSH evaluation adapter must flush and pin the selected Turn, Step, tool, and approval event range and verify external side effects independently; event replay is not side-effect reproduction.",
      "source_ids": [
        "src-dal-architecture",
        "src-dal-research",
        "src-dal-roadmap"
      ]
    },
    {
      "id": "claim-dsh-sandbox-limits",
      "text": "DSH sandbox evidence is runner-, platform-, and mode-specific and does not by itself establish network isolation; future DAL claims remain limited to the controls actually exercised.",
      "source_ids": [
        "src-dal-architecture",
        "src-dal-research"
      ]
    },
    {
      "id": "claim-controller-boundary",
      "text": "The run-to-run controller foundation is an offline observation subsystem separate from proposal lifecycle; an optional unmounted recorder bridge can supply pinned closed terminal observations, while PI governance, response learning, predictive selection, canary, and rollback control remain future work.",
      "source_ids": [
        "src-dal-architecture",
        "src-dal-roadmap"
      ]
    },
    {
      "id": "claim-runtime-generation-producer-boundary",
      "text": "DAL ships the runtime manifest/evidence contract, recorder consumer, and controller verifier; authoritative effective Loader configuration, resolver receipts, artifact closure, transition sequencing, and readiness remain owned by a future pinned DSH launcher service.",
      "source_ids": [
        "src-dal-architecture",
        "src-dal-roadmap",
        "src-runtime-generation-contract"
      ]
    }
  ],
  "retrieval_pointers": [
    {
      "id": "ptr-current-integration",
      "when": "Changing how dal participates in a dsh project",
      "uri": "repo://docs/architecture.md",
      "source_ids": [
        "src-dal-architecture"
      ]
    },
    {
      "id": "ptr-pinned-evidence",
      "when": "Making a claim about dsh, Cordis, GEPA, SkillOpt, or evaluated OSS options",
      "uri": "repo://docs/research-evidence.md",
      "source_ids": [
        "src-dal-research"
      ]
    },
    {
      "id": "ptr-future-only",
      "when": "Proposing production plugin deployment, optimizer execution, broader candidate application, provider expansion, or supply-chain integration",
      "uri": "repo://ROADMAP.md",
      "source_ids": [
        "src-dal-roadmap"
      ]
    },
    {
      "id": "ptr-dsh-guardrail-design",
      "when": "Designing DSH tool interception, permission escalation, trajectory evaluation, or telemetry export",
      "uri": "repo://docs/architecture.md",
      "source_ids": [
        "src-dal-architecture",
        "src-dal-research"
      ]
    },
    {
      "id": "ptr-runtime-generation",
      "when": "Implementing generation identity, Loader mutation binding, resolver evidence, or session stability",
      "uri": "repo://docs/runtime-generation-attestation.md",
      "source_ids": [
        "src-runtime-generation-contract"
      ]
    }
  ],
  "limits": [
    "Pinned upstream interfaces are pre-stable and require fresh source inspection before integration.",
    "The unavailable expected local SkillOpt checkout remains an evidence gap.",
    "No authoritative DSH runtime-generation producer, HMR readiness or imported-closure identity, final-disposal durability, mounted plugin, optimizer runtime, model behavior, external evaluator, or full dsh lifecycle integration is proved by this capsule."
  ]
}
