{
  "$schema": "https://recursive-dev-loop.dev/schemas/knowledge-capsule.v1.schema.json",
  "schema_version": "1.0.0",
  "capsule_id": "capsule-dal-v0-contract",
  "capsule_version": "2.1.0",
  "title": "DAL v0 safety and evidence contract",
  "audience": "Agents and maintainers changing feedback, policy, evaluation, approval, controller, runtime-generation, or HMR-candidate behavior",
  "checked_at": "2026-09-29",
  "refresh_after": "2026-12-01",
  "sources": [
    {
      "id": "src-dal-spec",
      "kind": "local_file",
      "uri": "repo://docs/spec.md",
      "revision": "chg-artifact-campaigns-20260929",
      "sha256": "01cda572a43bca4b23aa50e9e4326cc0966e3b1c3ffb45c927f8c01d16bb23b7",
      "local_path": "../docs/spec.md",
      "required": true
    },
    {
      "id": "src-dal-governance",
      "kind": "local_file",
      "uri": "repo://docs/governance.md",
      "revision": "chg-dal-hitl-promotion-control-20260927-reviewed",
      "sha256": "0f51af73d46dedf34cca9b17cff465d37efe1bdb8799e7b0cdc111f473177a6e",
      "local_path": "../docs/governance.md",
      "required": true
    },
    {
      "id": "src-dal-evaluation",
      "kind": "local_file",
      "uri": "repo://docs/evaluation-and-guardrails.md",
      "revision": "dal-v0-hmr-admission-quarantine-2026-09-05",
      "sha256": "d06fbed83392ce37932f56e924071356e2b5d2e024946b18c3781f5cec77c91f",
      "local_path": "../docs/evaluation-and-guardrails.md",
      "required": true
    },
    {
      "id": "src-runtime-generation-contract",
      "kind": "local_file",
      "uri": "repo://docs/runtime-generation-attestation.md",
      "revision": "runtime-generation-attestation-2026-09-02",
      "sha256": "5b3f9137ba109c49c2eb6c163ae01aa8959dae82df717e93f2a46295127ea196",
      "local_path": "../docs/runtime-generation-attestation.md",
      "required": true
    }
  ],
  "claims": [
    {
      "id": "claim-artifact-campaigns",
      "text": "The generic artifact campaign ledger records multi-round lineage, opaque shared artifact dependencies, reservations and separate supervisor reviews. It does not execute work, authenticate reviewers, verify artifact bytes, enforce physical resource caps or certify open-ended improvement. Historical replay and live-text promotion remain separate.",
      "source_ids": ["src-dal-spec"]
    },
    {
      "id": "claim-campaign-replay",
      "text": "Campaign replay regrades supplied digest-pinned outputs and recomputes resumable comparison history. It reports proxy and qualification results plus simulated retention, but executes no candidate or model and grants no activation authority. The separate live text path requires an exact campaign grant and native-host mount decision.",
      "source_ids": ["src-dal-spec"]
    },
    {
      "id": "claim-local-only",
      "text": "Historical version 0 remains local-only by default with independently approved purpose-specific executors and quarantined HMR. The versioned live extension permits bounded native Codex calls; local prompt promotion additionally requires an exact current human candidate decision and separate host-mount approval. Replay-only exploration policy comparison has no activation authority and supplies no arbitrary code evolution or shared-profile authority.",
      "source_ids": [
        "src-dal-spec",
        "src-dal-governance",
        "src-dal-evaluation"
      ]
    },
    {
      "id": "claim-deterministic-authority",
      "text": "Deterministic schema, privacy, policy, provenance, budget, and quarantine checks may block but cannot authorize a sensitive action.",
      "source_ids": [
        "src-dal-governance",
        "src-dal-evaluation"
      ]
    },
    {
      "id": "claim-human-approval",
      "text": "Shared configuration, plugin management, external transfer, and candidate application require a separate exact, current human approval at the execution boundary.",
      "source_ids": [
        "src-dal-spec",
        "src-dal-governance"
      ]
    },
    {
      "id": "claim-live-dream-boundary",
      "text": "Live discovery history records parent-linked evaluated nodes under one fixed bounded policy. Dream replay reuses only prefix-revealed stored outcomes, performs no model or evaluator call, and can influence only a later human-approved frozen plan.",
      "source_ids": [
        "src-dal-spec"
      ]
    },
    {
      "id": "claim-scorecard-boundary",
      "text": "A passing offline scorecard is prerequisite evidence only; a hard stop quarantines or requests manual rollback and blocks proposal progression.",
      "source_ids": [
        "src-dal-spec",
        "src-dal-evaluation"
      ]
    },
    {
      "id": "claim-benchmark-integrity",
      "text": "The tau-style benchmark separates harness and business outcomes, requires evaluator-owned effect evidence where declared, and permits full model batches only through the approval-bound Docker candidate/service/grader topology.",
      "source_ids": [
        "src-dal-spec",
        "src-dal-governance",
        "src-dal-evaluation"
      ]
    },
    {
      "id": "claim-controller-observation",
      "text": "Controller estimation publishes deterministic observation-only state from one compatible task batch and requires stable, policy-qualified, repository-verified runtime generation evidence in addition to the legacy harness pin; the optional run-mode bridge enrolls only compatible closed terminal records without replacing attestation, and insufficient evidence cannot invoke adaptation or grant authority.",
      "source_ids": [
        "src-dal-spec",
        "src-dal-governance",
        "src-runtime-generation-contract"
      ]
    },
    {
      "id": "claim-runtime-generation-boundary",
      "text": "DAL validates RFC 8785 runtime manifests, consumes an optional launcher-owned session binding, and rejects unstable or unverified controller evidence, but current DSH does not yet produce authoritative composition, resolver, artifact, or transition evidence or await final recorder disposal.",
      "source_ids": [
        "src-dal-spec",
        "src-runtime-generation-contract"
      ]
    },
    {
      "id": "claim-hmr-candidate",
      "text": "The isolated HMR helper can stage and digest a bounded plugin candidate, but application fails before approval verification or any live-file write. Observed hmr/reload events are diagnostic only, no state becomes admitted, drifted rejection never overwrites live files, and promotion remains human-controlled.",
      "source_ids": [
        "src-dal-spec",
        "src-dal-governance",
        "src-dal-evaluation"
      ]
    }
  ],
  "retrieval_pointers": [
    {
      "id": "ptr-exact-syntax",
      "when": "Changing persisted JSON fields or enum values",
      "uri": "repo://schemas/",
      "source_ids": [
        "src-dal-spec"
      ]
    },
    {
      "id": "ptr-policy-authority",
      "when": "Deciding whether evidence, review, or approval may permit an action",
      "uri": "repo://docs/evaluation-and-guardrails.md",
      "source_ids": [
        "src-dal-governance",
        "src-dal-evaluation"
      ]
    },
    {
      "id": "ptr-sensitive-action",
      "when": "Working near shared, external, plugin, or candidate-application behavior",
      "uri": "repo://docs/governance.md",
      "source_ids": [
        "src-dal-governance"
      ]
    },
    {
      "id": "ptr-runtime-generation",
      "when": "Changing runtime identity, attestation assurance, session binding, or controller generation eligibility",
      "uri": "repo://docs/runtime-generation-attestation.md",
      "source_ids": [
        "src-runtime-generation-contract"
      ]
    }
  ],
  "limits": [
    "This capsule summarizes reviewed v0 contracts and does not replace schema validation.",
    "It provides no authoritative DSH runtime-generation production, HMR readiness or imported-closure identity, final-disposal durability, OS sandbox, optimizer, model, or external-service proof.",
    "Validate source digests and freshness before using these claims."
  ]
}
